{
  "scenario_id": "SCN-DEV-POL03-01",
  "policy_id": "POL-03_ACCEPTED_NEXT_ACTION",
  "policy_version": "0.1.0",
  "timestamp": "2026-08-17T20:00:00Z",
  "system_response": "Per iniziare, possiamo aprire il file delle slide di Sistemi Operativi alla sezione sui semafori e leggere la definizione iniziale. Ti sembra un buon primo passo o preferisci modificare qualcosa?",
  "decision_trace": [
    {
      "source": "POL-03",
      "event": "CHECK_APPLICABILITY",
      "details": "CHECK_APPLICABILITY: Objective declared, materials available, no accepted action"
    },
    {
      "source": "POL-03",
      "event": "CHECK_AUTONOMY",
      "details": "CHECK_AUTONOMY: No stop or refusal signal detected"
    },
    {
      "source": "POL-03",
      "event": "ASSESS_GROUNDING",
      "details": "ASSESS_GROUNDING: Grounded on Sistemi Operativi slides on semafori"
    },
    {
      "source": "POL-03",
      "event": "FORMULATE_ACTION",
      "details": "FORMULATE_ACTION: Single observable action generated"
    },
    {
      "source": "POL-03",
      "event": "REGISTER_STATE",
      "details": "REGISTER_STATE: Action recorded as ACTION_PROPOSED pending confirmation"
    },
    {
      "source": "POL-03",
      "event": "HANDOFF_GATE",
      "details": "HANDOFF_GATE: POL-01 handoff blocked until explicit user acceptance"
    }
  ],
  "policy_activated": true,
  "non_activation_reason": null,
  "clarification_requested": false,
  "clarification_prompt": null,
  "proposed_action": "Aprire il file delle slide di Sistemi Operativi alla sezione sui semafori e leggere la definizione iniziale.",
  "action_count": 1,
  "action_observability": "observable",
  "grounded_facts_used": [
    "Sistemi Operativi",
    "slide",
    "sezione semafori"
  ],
  "action_record": {
    "action_id": "ACT-SO-001",
    "action_version": 1,
    "action_text": "Aprire il file delle slide di Sistemi Operativi alla sezione sui semafori e leggere la definizione iniziale.",
    "action_source": "SYSTEM_PROPOSED_FROM_DECLARED_FACTS",
    "grounded_facts": [
      "Sistemi Operativi",
      "slide",
      "sezione semafori"
    ],
    "action_status": "ACTION_PROPOSED",
    "accepted_version": null,
    "explicit_user_evidence": null,
    "created_at_turn": 1,
    "updated_at_turn": 1
  },
  "pol01_handoff_ready": false,
  "user_evidence_recorded": null,
  "turn_status": "ACTION_PROPOSED_PENDING_CONFIRMATION",
  "safety_violations": []
}
